INPUT:text	OUTPUT:category	CONFIDENCE:category	
Разглядывая их под микроскопом , мы увидим привычные нам шестеренки и валы , цилиндры и поршни , пружины и клапаны , зеркала и микросхемы .	[4]	100.00%	
Иногда талантливые люди , не найдя себя в науке и не в силах выдержать экономический стресс , уходят из археологии в бизнес и промышленность .	[4]	100.00%	
Кандидаты в депутаты от общественных организаций в свою очередь также должны иметь в своей программе как общие , так и специфические направления депутатской деятельности .	[6]	100.00%	
"Главное , чтобы "" социальные лифты "" не останавливались и чтобы шанс в них пробиться был не только у тех , кто умудрился родиться в "" нужной "" семье ."	[6]	100.00%	
Франция признает российских студентов и не признает российские дипломы .	[2]	100.00%	
Об этом сообщили в понедельник в пресс-службе администрации области .	[1]	100.00%	
С тех пор я в этом кабинете не появлялся .	[1]	100.00%	
Этот роман как раз и должен родиться на стыке .	[1]	100.00%	
Деревянный стол и две простые деревянные лавки в углу .	[1]	100.00%	
"Поэтому православной интеллигенции не может быть в природе "" …"	[2]	100.00%	
"Я позову ее кататься на лодке и утоплю "" ."	[1]	100.00%	
Он хранил у себя дома потрясающую коллекцию репродукций , которую собирал не только в московских библиотеках , вырезая их из редких книг , но и в домах своих друзей .	[5]	100.00%	
Маски являлись необходимостью во многих сферах жизни - на праздниках и священных обрядах , во время войны и охоты и даже в судебных процессиях .	[4]	100.00%	
В реальности учитель использует все эти роли в разных ситуациях и в разной мере .	[3]	100.00%	
Это где-то между наукой и искусством , и описать эту грань методологически очень сложно .	[4]	100.00%	
В таких условиях и здоровому человеку было выжить непросто , а больные и раненые люди умирали десятками в день .	[3]	100.00%	
При этом в дипломе все оценки не обязательно должны быть отличными и даже хорошими .	[2]	100.00%	
"Поэтому в последнее время в мире было создано новое поколение моделей общей циркуляции атмосферы и океана , в большей степени учитывающих океанические процессы "" ."	[6]	100.00%	
Осуждали меня и Николай Иванович , и Мери Михайловна .	[1]	100.00%	
Горячее прессование освоили еще в прошлом веке , и этот способ обработки металлов потеснил традиционные - ковку и штамповку .	[4]	100.00%	
Из этого путем неоправданной экстраполяции мы сделали вывод , что в принципе можем понять все и будем проникать в тайны мироздания до бесконечности , по крайней мере до тех пор , пока существуем сами .	[7]	100.00%	
Дело в том , что в тот давний день , когда мы возделывали пустырь , один из ребят обратил внимание остальных на то , как я держу носилки , на которых мы перетаскивали землю .	[5]	100.00%	
Хаос в экономике , которым воспользовались самые жадные и беспринципные , превратившие чуть ли не всех остальных в бедных .	[4]	100.00%	
Ниже нас по фронту были траншеи и ходы сообщения стрелковых подразделений и огневые точки с пулеметами и противотанковыми ружьями .	[5]	100.00%	
Местные художники , вывезенные в метрополию , и там обученные уже как чисто западные живописцы , графики и скульпторы .	[5]	100.00%	
Мы кое-что понимаем теперь и в Русском мире - настоящем , а не вымышленном .	[2]	100.00%	
Когда она наконец пришла и он увидал близко ее лицо и фигуру , он просто сказал : - Ну-ну !	[7]	100.00%	
Меня гортанно и резко окликнули и приказали покинуть сад .	[2]	100.00%	
В последние годы произошло ужесточение этого законодательства , в том числе в связи с будущим вступлением России в ВТО .	[4]	100.00%	
Затем абитуриент отключает на своем мобильнике звук и вибрацию и бесстрашно оставляет его на столе преподавателя или даже за дверью аудитории - как потребуют .	[5]	100.00%	
Потом Татьяна провалилась в сон и очнулась уже засветло .	[2]	100.00%	
Это вопросы не к ЕГЭ как таковому , а к качеству преподавания истории и литературы в российских школах вообще .	[3]	100.00%	
Потом два года службы в ракетных войсках стратегического назначения , работа на гражданке и счастливый брак длиною в 20 лет , в котором у мужчины родились мальчик и девочка .	[6]	100.00%	
В его маленькой двухкомнатной квартирке было неприбрано , видно было , что у него не хватает времени для уборки , и на газовой плите в кухне стояли невымытые кастрюльки .	[6]	100.00%	
И исполнительную власть , и _ законодательную , и бизнес , и судебную власть .	[4]	100.00%	
"Генерал-майор Сергеев убедительно попросил автолюбителей "" не вклиниваться в колонны "" и дать военным возможность беспрепятственно выбраться с баз и потом вернуться на них ."	[7]	100.00%	
Эта тема в другой связи обсуждается и несколько ниже .	[3]	100.00%	
Они шли с увала на увал и видели иногда сверху деревни с белыми крышами .	[3]	100.00%	
Так у них , у обличителей и у наблюдателей , создается иллюзия того , что они и в самом деле служат чему-то более высокому .	[6]	100.00%	
Сознание , которое тысячелетиями живет само по себе , без подкормки и подпитки , не стирается и не ржавеет - это же вечный двигатель .	[5]	99.99%	
С этого самого дня , так остро запомнившегося Гаянэ и совершенно забытого Викторией , в Гаянэ проснулась необыкновенная чуткость ко всему темному и тревожному .	[6]	100.00%	
Поэтому , если внимательно посмотреть на этот процесс и зарегистрировать от него вспышку электромагнитного излучения , то можно , расшифровав эту вспышку , кое-что узнать и про сам процесс .	[5]	100.00%	
Научная фантастика , как известно , предлагает и такие пессимистические сценарии , в которых вытеснение рутинного , малоинтеллектуального и тяжелого труда часто сопровождается вытеснением человека из сферы труда вообще .	[7]	100.00%	
Только с декабря 1986 г. по март 1987 г. им получено без оплаты продовольственных заказов на 2800 рублей , в том числе коньяка и вина - на 1400 рублей .	[4]	100.00%	
В том числе , в области гиперзвукового оружия и оружия на новых физических принципах .	[3]	100.00%	
Законы СССР и правовые акты органов государственной власти и управления СССР действуют на территории Литовской ССР лишь после их утверждения Верховным Советом Литовской ССР и регистрации в установленном порядке .	[7]	100.00%	
Хотя защищаться , в сущности , и не собирался .	[3]	100.00%	
Впрочем , вашингтонские журналисты говорят , что следователи не готовы на 100% утверждать , что покушение на Джояла не связано с его участием в программе про Александра Литвиненко или с каким-то иными его делами .	[7]	100.00%	
Постепенно начнут рушиться барьеры - между работой и домом , работой и уходом на пенсию , работой и досугом .	[3]	100.00%	
"Факт сам по себе чрезвычайно интересный , однако такое "" семеричное счисление "" возраста , в общем - то , вполне соответствовало границам физиологических и психологических перемен , происходящих в организме по мере взросления ."	[7]	100.00%	
Именно поэтому обидно , что в обычные дни мы не видим спешащих на помощь милиционеров и улыбающихся пассажиров метро .	[4]	100.00%	
Могло и у Кадырова лопнуть ( в юбилейный день , после которого он , считай , президент ) , могло и у многих других .	[6]	100.00%	
В 1990-х годах в экономически развитых странах расходы на рекламу и пиар росли в полтора - два раза быстрее , чем расходы на исследования и разработку новых продуктов , и даже обгоняли рост ВВП .	[5]	100.00%	
Основные исследования лаборатории сфокусированы в области коммуникаций , кооперации и обучения в многочисленных группах .	[4]	100.00%	
Энтузиазм и интеллектуальный подъем , вызванный таким открытием , заражает и ту научную среду , в которой оно произошло .	[6]	100.00%	
"Солдат ответил : "" А помните , в Симферополе в тысяча девятьсот четвертом году при отправлении нашего полка в Маньчжурию вы изволили выдать всем солдатам по рублю деньгами и по чарке водки каждому ? """	[7]	100.00%	
Мы , чем могли , облегчали их страдания и уже на своем транспорте отправляли в госпиталь на станцию Столбцы .	[3]	100.00%	
Позднее ленд-лиз распространяется на Китай , Грецию и Югославию .	[4]	100.00%	
Симпатичная , в золотых украшениях , на безымянном пальце правой руки серебряное кольцо с бриллиантом , в армейских френче , брюках , кепке и с оружием - трофей полевого командира , его дорогая игрушка .	[7]	100.00%	
Сегодня в ответном поединке решится , кто же встретится в плей-офф с ирландцами и завоюет путевку на чемпионат мира .	[3]	100.00%	
За неделю начальник управления собирался позвонить Савельеву , который занимал теперь такой же пост , как и Семен Еремеевич в соседней области , и узнать о деловых качествах Ефимовой .	[7]	100.00%	
О прежней профессии , конечно , и думать было нечего - с этим я примирилась безропотно , кто знает , может быть , с тайной радостью , что больше не надо изводиться отсутствием таланта …	[7]	100.00%	
Он поселился в Душанбе и напомнил о себе через год , когда выступил свидетелем обвинения на процессе Андрея Синявского и Юлия Даниэля , которые когда-то считали его своим другом .	[5]	100.00%	
"Помню , едем мы на съемки , Калик протягивает мне сценарий в синем переплете и показывает : "" Вот здесь в верхнем правом углу на моем деле было написано : "" ХВ "" "" ."	[5]	99.99%	
Вот разговариваю с коллегой и упоминаю о том , что очень люблю сирень , - для меня она ассоциируется с весной , сокрушаюсь , что в Сидар-сити нет сирени .	[6]	100.00%	
Естественно , я не пытался в этом кого-нибудь разуверить .	[2]	100.00%	
"Распорядился : "" Освободить и вернуть в Москву "" ."	[3]	100.00%	
В странах Балтии и в Польше такие опасения звучат .	[1]	100.00%	
Мембраны , ограниченные перегородками , нужно собрать в пакет , тогда то , что не доберет в исходном растворе одна мембрана , доберет вторая , третья и т. д .	[7]	100.00%	
Овцы и куры прекрасно вписались в культурный контекст инсталляций Ильи Кабакова , фотографий Марины Абрамович и лекций по урбанистике Герта Урхана , поскольку были правильно отобранными овцами и курами .	[5]	100.00%	
Он и в шестьдесят еще участвовал в самых известных марафонах в разных точках мира .	[1]	100.00%	
Кому я только его не показывал , никто не говорил , что фильм плохой , просили сократить , я сокращал , но фильм так и не вышел на экраны .	[4]	100.00%	
И все это _ не из-под палки , а добровольно и с огромным интересом .	[3]	100.00%	
Например , в октябре 2003 года в исследовательском центре Xerox разработали новую технологию подающего механизма для копиров и принтеров .	[5]	100.00%	
И он это понимал , это его и погубило .	[3]	100.00%	
Шахматы - настольная логическая игра специальными фигурами на 64-клеточной доске для двух соперников , сочетающая в себе элементы искусства ( в части шахматной композиции ) , науки и спорта .	[5]	100.00%	
Приведенные примеры показывают , как волна креатива поднимает на вершину капитализации те компании , которые функционируют на основе принципа : деньги делаются не на продукте и даже не на бренде , а на тренде .	[7]	100.00%	
Описание его маршрута было известно в средневековой Европе и могло быть известно братьям Поло ещё в их первом путешествии .	[4]	100.00%	
Большинство именно так и думает , хотя возникло это словосочетание в противовес церковному браку и означает как раз таки гражданский брак , зарегистрированный государством .	[7]	100.00%	
Заключение тюремного врача свидетельствует о том , что Абакумова ( ему было всего сорок с небольшим , и на здоровье он прежде не жаловался ) превратили в полного инвалида .	[5]	100.00%	
Такая вспышка наблюдалась в Челябинске , и очевидцы отмечают , что они чувствовали жар .	[2]	100.00%	
Если закрыть глаза на те из наших достоинств , которые существуют исключительно в наших глазах , я бы не решился утверждать , что такое сравнение - в нашу пользу .	[5]	100.00%	
Недаром Христос избрал апостолов из мужчин и не включил в их число свою мать .	[3]	100.00%	
В этих договорах определены основные направления совместной работы по повышению эффективности подготовки квалифицированных специалистов для печатных СМИ , участию работников кафедры и студентов в деятельности редакций газет и журнала .	[7]	100.00%	
Рыба подходила и ела , но крючок не брала …	[2]	100.00%	
Общественный прогресс настоятельно требует сообща решать и другие общечеловеческие проблемы ( экологическую , продовольственную , к примеру ) , налаживать конструктивное взаимодействие государств и народов в масштабах всей планеты .	[7]	100.00%	
Андрей Аркадьевич накрыл террариум крышкой и закрыл на защелку .	[2]	100.00%	
"Я тут же отозвалась и написала : "" Дорогой Сенечка , в этот день хочу тебе сказать , что мы тебя любим и помним ."	[6]	100.00%	
Потом хозяйка рассказала мне , как они , войдя в старый захламленный сарай , осмотрелись , почесали затылки и , высказавшись в том смысле , что тут сам черт ногу сломит , пошли назад .	[7]	100.00%	
"У нас изменились и условия , и возможности , и желание людей трудиться , и период активной жизни , поэтому решение принимать необходимо "" ."	[7]	100.00%	
Видимо , он разочаровался в том , что начиналось в перестройку , а уже в 1993 году ему стало ясно , что дело плохо .	[5]	100.00%	
Россия же , так и не успевшая стать национальным государством в тот период , когда это было мировой тенденцией , сегодня испытывает еще большие проблемы с осознанием единого прошлого .	[6]	100.00%	
Тех , кто остро ощущает их дефицит не только на выборах , но и в повседневной жизни , постоянно сталкиваясь с унижающим произволом чиновника .	[5]	100.00%	
Да ведь и на украинском фронте то же самое , хотя и масштабнее , одна газовая война чего стоит .	[5]	100.00%	
Все шесть добровольцев из американской редакции Popular Mechanics , согласившиеся опробовать на себе эту штуку , докладывали о дискомфорте различной степени тяжести , начиная с головной боли и кончая тошнотой , и пищеварительными эксцессами .	[7]	100.00%	
"Ученые сразу же синтезировали вещество - тот самый антиоксидант , который они подсмотрели в природе , прицепили его к молекуле - "" электровозу "" и стали испытывать сначала на клетках , потом на животных ."	[7]	100.00%	
Я даже не очень понимаю , в чем проблема .	[1]	100.00%	
"Узнать заветный список непросто , но американцы делают деньги и другим способом - точные прогнозы улучшают их репутацию и превращают в "" звезд "" биржевой аналитики , а такой статус автоматически означает повышенную зарплату ."	[6]	100.00%	
При этом ученые обращают внимание на то , что даже в традиционно много работающих Японии и Великобритании производительность труда при росте занятости не растет ( Япония ) и даже незначительно падает ( Великобритания ) .	[6]	100.00%	
Кстати , может быть , именно в условиях войны и разрослись непомерно эти пороки .	[3]	100.00%	
Что кризис в отношениях с Западом стал отмычкой , чтобы распечатать разные государственные фонды - и Пенсионный , и фонды развития , и , может быть , золотовалютные резервы ?	[6]	100.00%	
Как сообщили в понедельник в ГУГО и ЧС Москвы , в воскресенье около 18 четверо детей из афганской семьи возвращались домой через Чермянский пруд .	[7]	100.00%	
Если в организме клеток гибнет больше , чем рождается , это и означает старение .	[2]	100.00%	
Козак говорит о коррупции и клановости на Северном Кавказе ?	[2]	100.00%	
