INPUT:text	OUTPUT:category	CONFIDENCE:category	
Имя ему - творческий труд , который в будущем потеснит , а может быть , даже и вытеснит труд обыденный , рутинный и тяжелый .	[7]	100.00%	
В среду на пресс-конференции в Москве он , в частности , заявил , что распространенность ВИЧ в России позволяет сделать вывод о полномасштабной эпидемии .	[5]	100.00%	
Как и в любом дневнике внимательного ( надеюсь , внимательного , я старался ) наблюдателя , некоторые темы собрались в пучки , стали метасюжетами .	[5]	100.00%	
Я креплюсь , но это выражение добродетельного терпения меня все-таки подтачивает , и я по дороге перестраиваюсь и делаю вид , что про серьезное я начал говорить нарочно , чтобы потом было еще смешней .	[7]	100.00%	
Академик Аганбегян считает : в первую очередь следует досконально исследовать уровень технологий , машин и оборудования в каждой отрасли .	[6]	100.00%	
Строго говоря , советский ее этап особого интереса не представляет , ничего нет особенного и в технологии трансформации советского руководителя в российского регионального вожака .	[7]	100.00%	
"Мы ничего не боялись и дома воспитывали "" предков "" , что они , дураки , боялись какого-то Сталина и ждали арестов по ночам ."	[7]	100.00%	
На мой взгляд , лучший способ действий - превращать противников в конкурентов , _ конкурентов - в партнеров , а затем и в союзников .	[5]	100.00%	
Да и работать она может только в системе связи , у нее узкая специальность .	[2]	100.00%	
Как сообщают в четверг метеослужбы Италии , в последний раз столь жаркий июнь наблюдался в Италии в 1782 году .	[3]	100.00%	
Вскоре исчезла и вторая сестра - и вновь заговорили об их связях с немцами .	[1]	100.00%	
Легкие и нержавеющие материалы как нельзя кстати в судостроении .	[2]	100.00%	
В Хабаровской государственной академии экономики и права с участием Рагхунатха и членов индийской делегации пройдет конференция о состоянии и перспективах российско - индийских отношений .	[7]	100.00%	
Так и с ФД : любой математик проверит доказательство даже из той области , в которой он не разбирается .	[5]	99.99%	
В новой школе , как в реальном технопарке , детям интересно и удобно вместе учиться , открывать новое и делать это новое доступным другим .	[4]	100.00%	
Проблема заключалась в средневековых приемах и условиях обработки земли .	[3]	100.00%	
Врач отпрянул , захлопнув дверцу , и с грохотом опустился на стул , который , по счастью , стоял как раз в нужном месте .	[2]	100.00%	
То есть он из одной части , из одной области прокачивает протоны в другую область и там их отпускает , снова берет протон , перекачивает в другую и отпускает .	[6]	100.00%	
Суд должен быть в подчинении закона и гаранта Конституции .	[2]	100.00%	
"В декабре 1968 года я повесил на учебных корпусах , на Большой Пироговке и Погодинке , объявления : "" Приглашаются студенты , желающие заниматься в секции космической медицины "" ."	[5]	100.00%	
"Приветствую Вас и сообщаю с сожалением , что моя лекция "" Либерализм и национальный вопрос "" "" пропала "" где-то в недрах нашей колонии ."	[7]	100.00%	
Тот типаж силовика , который предпочитает стрелять на передовой , а не зарабатывать награды и звания в безопасном тылу .	[6]	100.00%	
Наконец , желая успокоить страсти , на одной из лекций в МИФИ Чернобров дал обещание пожертвовать одним из катастрофных деревьев , спилить его и на спиле поискать обугленный канал .	[7]	100.00%	
Потому , что главное , на мой взгляд , - это не используемые властью политические технологии и даже не отношение молодежи к Владимиру Путину .	[4]	100.00%	
Пожалуй , самый громкий на этих Играх , хотя в словах Юстины не могло быть в принципе ничего сенсационного .	[6]	100.00%	
Во второй половине сентября Жуков организовал новое отвлекающее наступление на северный фланг армии Паулюса с тем же результатом , что и в первый раз .	[4]	100.00%	
"Ведь и итальянцы , и немцы , и все другие рассуждают примерно так : переводить деньги на родину , где нет стабильности в вопросах налогообложения , не стоит "" ."	[7]	100.00%	
В Якутии бабушку раздражал плач семимесячной внучки , и она ее сожгла в печи .	[2]	100.00%	
По сведениям рабочих , в здании находятся баллоны с ацетиленом и кислородом , которые могут в любой момент взорваться .	[4]	99.99%	
Популярный политик окажется в окружении карьеристов - неудачников , политических бомжей и мелких оппортунистов , которые сбегутся на его зов , надеясь если не пройти в Думу , то хоть поживиться от предвыборной кампании .	[5]	100.00%	
Жители Москвы могли наблюдать Красную планету во всей красе 27 сентября в 22 часа 15 минут на юго-востоке между альфой в созвездии Водолея и альфой в созвездии Южной Рыбы .	[5]	100.00%	
"Проблема состояла в том , что в Москве и Вашингтоне по-разному понимали , что такое "" особые интересы "" ."	[3]	100.00%	
В Ленинграде погибли от голода его мать и сестра - вся маленькая семья , - и не было для него иного смысла существования , кроме участия в прорыве блокады .	[5]	100.00%	
"Закрытые корпоративные и государственные сети , вроде американской SIPRNet , сайты которой располагаются в доменных зонах smil.mil и sgov.gov ( она оказалась чуть "" приоткрытой "" благодаря усилиям WikiLeaks )"	[7]	100.00%	
"И получается , что хоть в проекции ледник и сократился , но в объеме он может продолжать расти "" ."	[5]	100.00%	
Государство , в классическом смысле этого понятия , в Афганистане закончилось в 1992 году .	[3]	99.99%	
И дело здесь не только в отсутствии хороших манер .	[1]	100.00%	
Из упомянутого телевизионного продукта следовало , что Медведева выбирали на президентство не как авторитетного и перспективного политика , а как сумму сигналов Западу , Востоку и для внутренних нужд .	[7]	100.00%	
В нынешнем году в вузы поступала и какая-то часть выпускников прошлых лет , у нас в ГУ ВШЭ они составили примерно 12 процентов абитуриентов .	[6]	100.00%	
Окна были холодны и прозрачны , но лавки с печками источали сухое тепло , и хорошо было смотреть на солнечные снега за окнами , когда поезд тронулся , и слушать быстрое мягкое постукивание колес .	[7]	100.00%	
Руководящую роль в политике и экономике играли родовые кланы .	[1]	100.00%	
Как и все сталинское руководство , он запятнал себя участием в чудовищных преступлениях режима .	[3]	100.00%	
"Для этого , по его словам , потребуются "" самые серьезные системные изменения и в организации медицинской помощи , и в техническом перевооружении медицинских организаций , и в качественном изменении кадрового потенциала здравоохранения "" ."	[5]	100.00%	
Закончив в Иерусалиме религиозную школу , молодой Ицхак Навон поступает в Еврейский университет , где изучает литературу и педагогику , а также - арабский язык и культуру арабских стран .	[7]	100.00%	
Есть , однако , и другая формулировка - так называемый сильный антропный принцип , который такого хитрого и не поддающегося проверке объяснения не требует .	[7]	100.00%	
Плотный рослый мужчина с низким лбом и густыми волосами , одетый в форменную одежду .	[2]	100.00%	
Он тогда не напьется и я смогу с ним поговорить начистоту , по душам .	[3]	100.00%	
Мне тоже совсем не улыбалась перспектива идти без остановок в Таиланд и потерять Индонезию .	[2]	100.00%	
"Человек этот был гуманитарной интеллигенцией , проживал один в малогабаритной квартире на улице Цюрупы ( пятый этаж без лифта ) и целыми днями читал "" Брокгауза и Ефрона "" ."	[7]	100.00%	
"Еще одним конкурентом Госстроя и РКС может стать "" Росэнергоатом "" , который активно создает собственную сбытовую сеть и присутствует уже в 13 регионах ."	[5]	100.00%	
Вышестоящие инстанции пресекли беззаконие еще в середине прошлого года коллегия по уголовным делам Верховного суда РСФСР и Прокуратура РСФСР отменили все обвинительные решения Башкирии по Богданову и прекратили уголовное дело за отсутствием состава преступления .	[5]	100.00%	
Что человечеству дали Максвелл и Фарадей , Александр Степанович Попов и Дмитрий Иванович Менделеев , Николай Иванович Вавилов , широкое население знает плохо , но без этих работ мы не имели бы почти ничего .	[5]	100.00%	
Возможно , подход американских психологов и пересмотр их позиций в отношении роли оптимизма и психического здоровья нации связан с широкой практикой психоанализа и психотерапии в США и необходимостью искать новые способы воздействия на пациентов .	[7]	100.00%	
Впервые Институт русского языка им. Виноградова проводит опрос в интернете , чтобы узнать , какие слова и выражения про мобильный телефон и действия с ним люди используют чаще всего .	[3]	100.00%	
И я был готов - что и сделал - обсудить некоторые общие проблемы , возникающие в подобного рода ситуациях , и риски , которые , на мой взгляд , полезно учитывать в собственной работе .	[7]	100.00%	
"Одного мальчика с соседнего двора так и прозвали "" Гитлер "" - очень на него был похож , и сильно ему за это доставалось ."	[2]	100.00%	
Эти страны будут испытывать серьезные экономические трудности , и сохранение в них современного экономического роста в рассматриваемом понимании проблематично .	[7]	100.00%	
О том , какие импульсы к переменам проявляются сегодня и какую роль в них играют этнические факторы , я планирую в скором времени рассказать .	[6]	100.00%	
Я не хочу оказаться в такой же ситуации и уговаривать людей посоперничать со мной .	[2]	100.00%	
И , несмотря на общий азарт наживы , характерный вначале для США , а потом охвативший весь мир , в Троицке сохранился дух и азарт прикладной науки и инноваций .	[6]	100.00%	
Если в МГУ по каждому предмету есть специалист , который ведет научную работу в своей области , то в таком вузе один преподаватель читает 3 - 4 разных курса .	[5]	100.00%	
Опыт и практика показывают , что на самом деле не надо , рано еще .	[5]	100.00%	
Я уверена , что когда эта барышня вырастет , то она точно с такой же естественностью наденет джинсы и простую майку , пойдет в них в театр и будет выглядеть там абсолютно к месту .	[7]	100.00%	
"Оказалось , что мы не "" впереди планеты всей "" , что мы занимаем "" середину турнирной таблицы "" , причем даже в такой области , которой привыкли гордиться - в области математического образования ."	[5]	100.00%	
Вот не придет же в голову Виктору Шендеровичу поступить как-нибудь дурно только потому , что и другие так поступают .	[5]	100.00%	
Это dutch oven - мясо , тушенное в огромном казане , которое томится целую ночь в специально выкопанной яме на горячих булыжниках , и сверху также заложенное теплыми камнями .	[4]	100.00%	
При нем суд принимает весьма своеобразные решения , потому что вынужден руководствоваться не только законом , но и рядом обстоятельств , не прописанных вообще ни в каких документах , однако на практике чрезвычайно значимых .	[7]	100.00%	
Другой пример - США , где одна из лучших в мире систем образования в школе и колледже вызвала экономический рост первой трети XX века .	[4]	100.00%	
Глеб купил свежую рыбу и держал ее в руках .	[1]	100.00%	
Москва держится до последнего и ничего не меняет - это тоже формула стабильности , и другой у нее нет .	[4]	100.00%	
Согласно договору , подписанному в 1919 году в Зеркальном зале Версальского дворца , к Франции навсегда отошли Эльзас и Лотарингия и на 15 лет - _ Саарский угольный бассейн .	[7]	100.00%	
Участие государства в развитии Сибири необходимо : частный бизнес не пойдет работать в не освоенную глушь , где нет дорог , людей и электроэнергии .	[6]	100.00%	
С приходом к власти М. С. Горбачева в отношениях России и Италии наметились перемены , и в конце 1980 - начале 1990-х годов образ СССР , а затем России стал восприниматься итальянцами более позитивно .	[6]	100.00%	
Тогда на островах нашли урановую руду , но дальше проектов и одного исследовательского реактора в университете Кентербери ( 1962 - 1981 ) дело не пошло , а в 1987-м страна объявила себя безъядерной зоной .	[7]	100.00%	
Средняя температура в мире в результате выброса в атмосферу продуктов сгорания упадет до такого уровня , что в подавляющем большинстве стран перестанет вызревать урожай .	[3]	100.00%	
Заседание - оно и в Берлине заседание , и ничего интересного на нем , конечно же , не услышишь .	[4]	100.00%	
Она вовремя соскочила , развелась и уехала в Лондон .	[1]	100.00%	
Папа , мама и Толя , все уехали в город , я осталась одна .	[2]	100.00%	
Подобная конспирология описывает в том числе наиболее громкие и трагичные инциденты в США . такие как нападение на младшеклассников в Коннектикуте в декабре 2012 года и массовое убийство в школе штата Флорида зимой 2018-го .	[6]	100.00%	
Впрочем , его и раньше применяли в термических прессах при плавлении и ковке металлов .	[3]	100.00%	
Регулярное использование Цилиндров Фараона при соблюдении ряда правил в повседневной жизни укрепляет и усиливает энергопотенциал и способствует развитию сверх-возможностей здорового и нравственно чистого человека .	[7]	100.00%	
В советские времена горная техника весьма низкого качества производилась на Украине и в Казахстане .	[3]	99.99%	
Однако и в Грязях нас устраивало далеко не все .	[1]	100.00%	
Я был пару раз в Багдаде в дорогих ресторанах на набережной - заказывал мазгуф .	[3]	100.00%	
Есть и лимоновцы , и даже бывшая либеральная публика .	[2]	100.00%	
В результате потерь кораблей и морской авиации в первый день войны не было вообще .	[3]	100.00%	
В России же традиционная институциональная среда разрушена , а новая не создана , и уже сам этот факт ставит под сомнение возможность передачи в таком обществе как традиционных , так и любых других норм .	[7]	100.00%	
Так что встречались мы и расставались спокойно и радостно .	[1]	100.00%	
Нам выписали направление , и на этот раз Цики безоговорочно погнал таксиста в госпиталь .	[4]	100.00%	
Эта истина фиксируется в документах ЮНЕСКО и Совета Европы .	[2]	99.99%	
"Да , наверное , сегодня можно прийти в "" Газпром "" или "" Роснефть "" и попросить там дополнительный триллион рублей в виде дивидендов ."	[2]	100.00%	
С тех пор я полюбил Крым и эту тропу , где я видел вас только мгновение и потерял навсегда .	[3]	100.00%	
Первые такие устройства появились в начале 70-х годов и были размером с хороший чемодан .	[3]	99.99%	
Глаз различал валявшиеся в беспорядке лейки и садовые инструменты .	[1]	100.00%	
Я имею в виду Сибирское отделение и Новосибирский университет .	[3]	100.00%	
Основной вывод из нашего теста - пора отправлять телевизоры на кухню и в спальню .	[3]	100.00%	
На последний юбилей Инны я принесла в качестве подарка давнюю фотографию дня рождения моей подруги - там все такие молодые , а я еще и беременная , поэтому очень толстая и совсем не Ренуар .	[6]	99.99%	
Оболочку Земли , в которой протекают биохимические процессы , он и предложил называть биосферой .	[3]	100.00%	
"При такой технологии исходный раствор и органический _ , содержащий "" вещество - извлекатель "" , ничем не разделяются и в месте контакта перемешиваются ."	[5]	99.99%	
"Массовый характер приняли попытки , нередко успешные , получения бюджетных средств под "" исследования "" и "" изобретения "" без предварительной экспертной оценки ведущих российских и иностранных ученых , специалистов в данной области науки ."	[7]	100.00%	
