INPUT:text	OUTPUT:category	CONFIDENCE:category	
Сам характер грузинской революции обуславливался в том числе и национальным проектом , в соответствии с которым в планы новой грузинской власти уже не входила традиция деления власти с Москвой .	[7]	100.00%	
С другой стороны , избиратели , голосовавшие за Медведева , спокойно переносят унижение своего избранника , что можно рассматривать и как дополнительное унижение , и как проявление отношения избирателей к выборам и своим голосам .	[6]	100.00%	
Этот тюк два дня лежал в коридоре , прикрытый рогожей , а позавчера хозяйка попросила убрать его с глаз долой и отнести в старый курятник , находящийся за сараем .	[7]	100.00%	
Советских людей не может не беспокоить тот факт , что за последнее время возникают нетерпимость , трения , а то и конфликты на межнациональной основе , происходит нагнетание такого рода противоречий в прибалтийских республиках .	[7]	100.00%	
Никакой геометрии в этом устройстве не было , и московские улицы формировались как пути от одной усадьбы к другой .	[4]	100.00%	
Агент МИ6 работал паспортистом в посольстве Великобритании в Берлине .	[3]	100.00%	
И вот в ноябре 1971 года в Грузии была открыта новая транспортная линия , в которой контейнеры со стройматериалами - галькой и щебнем - двигались , подталкиваемые лишь силой ветра , дующего в трубе .	[7]	100.00%	
Немцы , захватив город , расстреляли и повесили коммунистов , евреев собрали в гетто , и началась повседневная жизнь .	[5]	100.00%	
"После его окончания он получил золотую медаль за диссертацию на степень доктора медицины "" Изучение химического состава и лечебного действия минеральных вод России "" ( написана и издана на латыни в 1825 году ) ."	[5]	100.00%	
Может быть , еще и поэтому я захотела отвечать сама за себя и параллельно с мультфильмами стала писать рассказы .	[4]	100.00%	
Оказалось , что есть известный специалист с русским именем Вадим Макаров , который сейчас работает в Канаде и достиг в своем деле больших успехов .	[3]	100.00%	
Мы уже сейчас тратим на пенсии в процентах к ВВП столько же , сколько _ развитые страны с более пожилым населением , при этом у нас высокие страховые взносы и не очень высокие пенсии .	[7]	100.00%	
Помню , как прямо в спортивном костюме я поехал домой , и на улице почему-то все на меня оглядывались .	[5]	100.00%	
"Из мира подданных , государственно полезных и бесполезных , должных и обязанных , все переселились в мир свободных индивидуумов , с приоритетом прав человека над "" интересами государства "" ."	[7]	100.00%	
На сегодняшний день сфера образования в России имеет не более 4,5 % ВВП , в то время как в развитых странах на нее приходится 7 - 8 % ВВП .	[4]	100.00%	
Большое место в книге занимает анализ финансово - экономических последствий ограбления евреев в оккупированных и зависимых от немцев странах .	[3]	100.00%	
Этих денег я ей так и не вернула , потому что вскоре она умерла .	[4]	100.00%	
Впрочем , загрузили дополнительно и основательно не только детей .	[3]	99.99%	
Демократическим странам еще предстоит найти ответ на вопрос о рациональном соотношении толерантности и приоритета прав человека и защиты интересов основного населения на рынке труда .	[7]	100.00%	
Когда выпадет снег и гимназистки будут румяные , от мороза чуть пьяные , он приедет с войны чуть изменившийся и обнимет почти сразу , после того как сбросит Фросе на руки башлык и шинель .	[7]	100.00%	
В политико - военных и военно - стратегических прогнозах и планах США учитывают нередко в совокупности наши два государства .	[7]	100.00%	
"В реальности материальные институты и культурные традиции находятся в нерасчлененном единстве , поэтому современные институциональные теории рассматривают идеальные нормы , "" правила игры "" в качестве такого же института , как и социальные организации ."	[7]	100.00%	
Так все-таки вы не исключаете активизации патриотизма на фоне Украины как двигателя окончательного укрепления Путиным своего рейтинга и обеспечения проблемы своего избрания в 2018-м на окончательно зачищенной политической площадке ?	[7]	100.00%	
Он задумался , чуть перекосив худенькое лицо , и даже перестал выдергивать цветы и травинки , в его коричневых глазах появилась боль - так трудно вложить в чужую душу самые простые и очевидные истины !	[6]	100.00%	
Как и на прошлом судебном процессе , следствие и суд попытаются сыграть на религиозном возрождении в стране , на благожелательном отношении общества к церкви .	[6]	100.00%	
На этом обсуждении минфиновцы требовали ни в коем случае не отходить от утвержденного ранее бюджетного правила - то есть не увеличивать инвестиции в экономику и надеяться на ее самоисцеление .	[4]	100.00%	
У нас в течение 90-х годов эта сфера тоже неуклонно росла , увеличившись с 33 % в 1990 году до 54 % в 2004-м .	[5]	100.00%	
На беду тонкими ценителями семечек были и сороки , и воробьи , и синицы .	[2]	100.00%	
Электричества , разумеется , не было и в помине .	[2]	100.00%	
"Острая конкуренция в борьбе за доступ в "" социальный лифт "" - это и нормальное , и ожидаемое явление ."	[4]	100.00%	
Я не верю в кровавый террор сверху в России .	[2]	100.00%	
"У нее было много предположений , которыми время от времени она со мной делилась : "" Папа попал в плен и пошел в партизаны ."	[6]	100.00%	
Что интересно - нет никаких разногласий и в политике .	[2]	100.00%	
Скажем , в таких экономиках , как американская и европейская , государство на 50 процентов финансирует расходы на науку .	[4]	100.00%	
"О первой он упоминает однажды и мимоходом как об известном , само собой разумеющемся и отнюдь не решающем факторе , второй же квалифицирует как проводимый "" пунктиром на периферии ( немецкого ) общества "" ."	[7]	100.00%	
Не получилось , и Ельцина стали топтать ногами с той же страстью , с какой еще недавно потрясали его портретами на митингах и демонстрациях .	[6]	100.00%	
Однако в российском законодательстве нет положения об этом звании , хотя в нашей стране есть немало городов и селений , где в годы Великой Отечественной войны 1941 - 1945 годов шли длительные кровопролитные сражения .	[7]	99.99%	
Как подчеркнул Волин , формирование такого рода консорциума инвесторов в пользу той или иной команды , претендующей на вещание на шестом телеканале , это дело самих предпринимателей и журналистов .	[7]	100.00%	
Он рискнул всем - и карьерой , и здоровьем .	[2]	100.00%	
"Оба устройства нашли применение в НИИ нейрохирургии и в службе "" Скорой помощи "" ."	[5]	100.00%	
В следующем послании Онищенко постарается учесть проколы и на агентурные данные уже не ссылается : анализ и только анализ .	[6]	100.00%	
В этом заключались его и сила , и слабость .	[2]	100.00%	
Да , оно сокращается , в том числе в связи с урезанием социальных программ .	[4]	100.00%	
"Секретарь партийного комитета завода "" Салют "" А. Г. Самаркин проявил беспринципность и угодничество , не пресекал нарушения партийной и государственной дисциплины , пьянство и корыстные злоупотребления руководителей предприятия ."	[7]	100.00%	
Министр по чрезвычайным ситуациям России Сергей Шойгу в среду вылетает в Краснодарский край , чтобы на месте оценить ситуацию с паводками и определить меры по защите населения от стихии .	[4]	100.00%	
Тут он вспоминал что-то новое , бледнел от ужаса и начинал заговариваться и забываться .	[5]	100.00%	
С тех пор труднопреодолимые и , в общем , малоприятные обстоятельства в моем сознании прочно связались с подземным миром .	[6]	100.00%	
Мне дали третью группу инвалидности и выпустили в жизнь .	[2]	100.00%	
"Там - работы художников , родившихся и получивших образование в бывших владениях Британии ; если чисто эстетски говорить о "" наследии "" колониализма , представленное в шестом разделе , - самое лучшее из возможных ."	[5]	100.00%	
"Во-вторых , надо реально вывести с Восточной Украины всех этих "" отпускников "" и то , на чем они "" в отпуск "" ездят ."	[7]	99.99%	
Воспользовавшись этим , 9 декабря 1940 года английские войска переходят в наступление в Египте , в январе занимают всю Киренаику и к февралю 1941 года выходят в район Эль-Агейла .	[7]	100.00%	
Три дня и три ночи Гарусов прожил в изоляторе .	[1]	100.00%	
Мало того , они не просто летают вдоль строгих линий , но уходят в землю и выходят из нее !	[4]	100.00%	
Когда в кислом растворе накопится около 0,5 г урана на литр , его перекачают на берег и подвергнут переработке .	[3]	100.00%	
"Лишая депутатов и чиновников возможности иметь зарубежные счета и недвижимость , он возвращает советскую ситуацию , тесно привязывая их к себе и выводя из-под "" тлетворного "" западного влияния ."	[7]	100.00%	
Глав законодательных собраний регионов , по его словам , познакомят с работой нижней палаты , в частности , законопроектами , которые будут обсуждаться в ходе весенней сессии в Госдуме .	[7]	100.00%	
Модель паровой машины и ракетный двигатель , наглядные пособия по конструированию машин и адаптивный мобильный робот - сапер , узлы самолета времен Великой отечественной войны и шлем пилота с устройством ночного видения последнего поколения .	[7]	100.00%	
Не красть туалетную бумагу в учреждениях и междугородных поездах .	[2]	100.00%	
Однако не их число и не величина территории определяют место страны и ее влияние .	[3]	100.00%	
На выборах в рейхстаг в марте 1933 года коммунисты получили 81 мандат , но не были допущены на заседания .	[3]	100.00%	
Скажем , в Татарии одно представление о татаро - монгольском иге и о присоединении Казани и Астрахани к Москве , а в Москве другое .	[4]	100.00%	
"Он выступит на конференции "" Экономика знаний и интеллекта ."	[1]	100.00%	
Никогда не был он так загружен и обременен делами , как в годы детства .	[3]	100.00%	
Дело в том , что в космонавтике совершался переход от кратковременных к длительным полетам .	[4]	100.00%	
Вечером в четверг глава МИД России прибыл в Москву .	[2]	100.00%	
Сейчас в правительстве есть несколько амбициозных , здравомыслящих чиновников , хотя они не всегда и свободны в своих действиях .	[4]	100.00%	
Особенностью автомобильной очереди было лишь то , что формировалась и поддерживалась она в течение целого года и состояла приблизительно из 1000 довольно крутых мужиков .	[6]	100.00%	
"То есть оно не про "" красоту "" и даже не про художественную технику , а про то , как общество думает , и - в данном случае - как оно видит собственное прошлое ."	[5]	99.99%	
Например , финский исследователь Аско Парпола считает , что в качестве писчего материала могла использоваться ткань и тексты на таком материале сохраниться не могли .	[6]	100.00%	
Какое было счастье , и еще , наверное , и не такое будет , только бы не было войны !	[7]	100.00%	
Ген преимущественно экспрессируется в области мозжечка и заднего мозга .	[5]	100.00%	
По всем экономическим показаниям и по тем суммам , которые заложены в бюджете на ЖКХ , теперь нужно повышать коммунальные тарифы в два раза .	[5]	99.99%	
И в тех или иных вариациях рядом депутатов он несколько раз уже вносился на утверждение в Госдуму , но …	[7]	100.00%	
Иными словами , французы теперь держат деньги в Бельгии , немцы - _ в Австрии , то есть там , где надежнее , где выше проценты и где банковские клерки не задают лишних вопросов .	[7]	100.00%	
Книги и рассказы об успехах Пруссии не требовали переводчика .	[1]	100.00%	
Провал российской сборной на Олимпиаде в Ванкувере вызвал широкий резонанс , а Лондон - 2012 , да и Сочи - 2014 не за горами .	[5]	100.00%	
Во вторник нефть снова резко упала в цене после заявления Ирака в понедельник вечером о предоставлении беспрепятственного доступа в страну инспекторам ООН по вооружению .	[7]	100.00%	
"Однако "" Крымский кризис "" и события вокруг Украины привели к тому , что Европейский Союз в целом и отдельные его государства пересмотрели основные направления сотрудничества Европы с Россией ."	[5]	100.00%	
Найденный младенец - мальчик , был в черном целлофановом пакете , укутан в маленькую тряпку и весь в крови .	[2]	100.00%	
Повреждений железнодорожному пути и контактной сети пожар не нанес .	[3]	100.00%	
У меня хватило сил отвечать на расспросы и даже войти с милиционерами в комнату .	[2]	100.00%	
Мне нельзя было позволить себе быть слабой и мягкой , иначе я бы не справилась с той ролью , которую учителя и мои соученики ( микровариант общества ) считали для меня естественной и почетной .	[7]	100.00%	
"Будто бы победу Бобовникова обеспечили не только вбросы на одних участках , но и "" выбросы "" на других , когда результаты по участкам , голосовавшим в основном за Новикова , просто были проигнорированы ."	[7]	100.00%	
Миша потрясен был всем происшедшим и в первые минуты плакал от жалости и испуга .	[3]	100.00%	
Наличие лазерного целеуказателя обеспечивает точность и оперативность прицеливания и поражения цели с первого выстрела .	[3]	100.00%	
Валютный курс при саддамовском режиме по разным сделкам и операциям отличался в тысячу раз .	[6]	100.00%	
Он был в номере и услышал где-то недалеко выстрелы .	[1]	99.99%	
Вопрос о достаточности фонда не стоит в повестке дня .	[2]	100.00%	
Да и вообще Новиков на этих выборах - фигура трагическая , что не может не вызвать сочувствия в избирателе .	[5]	100.00%	
Я не был готов возвратиться в Ленинград и согласился .	[1]	100.00%	
"Консультанты разделили рынок бизнес-образования на два сегмента : в первый вошли все государственные и негосударственные вузы РФ со специализацией "" экономика и управление "" ."	[5]	100.00%	
Местные правители и вожди - в западных нарядах , или с элементами западных нарядов .	[3]	100.00%	
У выводковых птиц ( гагарообразные , курообразные , гусеобразные и другие ) птенцы вылупляются зрячими , способными в первые же часы жизни передвигаться вслед за родителями и кормиться самостоятельно .	[7]	100.00%	
Тем временем английская армия перешла в наступление в Ливии .	[2]	100.00%	
В результате аварии пассажирского автобуса и грузовика на автотрассе A31 неподалеку от города Мец на северо-западе Франции погибли , по меньшей мере , семеро и ранены около 30 человек .	[4]	100.00%	
"По его словам , Всемирный экономический форум "" внимательно следит за тем , что делает правительство России , каких успехов оно добивается в своей деятельности и в реформах "" ."	[7]	100.00%	
И , выйдя на улицу утром в четверг , я вдруг почувствовал , что мне не хватает англичан с их песнями , речевками и шарфами , с их морской походкой и тремя словами по-русски .	[7]	100.00%	
"Они никогда не устают и не боятся огня "" ."	[1]	100.00%	
В идеале эти два компонента должны быть полностью согласованы друг с другом по типам помещаемой в них информации и по формальным языкам ее записи .	[6]	100.00%	
Я не вижу , кто , где и в каком подвале ее будет обрабатывать .	[3]	100.00%	
Пожалуй , самое благородное место в казино - концертный зал , где частенько проходят концерты местного оркестра средней руки , а раньше выступали и Лист , и Брамс , и Мендельсон , и Штраус .	[5]	100.00%	
Позднее он был доставлен в больницу для медицинского освидетельствования и был признан психически неуравновешенным .	[1]	100.00%	
"Ты не знаешь , что тебя ожидает за следующим поворотом галереи и что будет в конце многометрового колодца "" ."	[3]	100.00%	
